{
  "annotation_schema_version": "0.1.0",
  "guideline_version": "0.1.0",
  "bundle_type": "synthetic_examples",
  "dataset_id": "annotation-framework-examples",
  "dataset_version": "0.1.0",
  "annotations": [
    {
      "annotation_id": "synthetic-annotation-001",
      "sample_id": "synthetic-benign-001",
      "record_type": "single_turn",
      "annotator_id": "synthetic-example-only",
      "annotator_role": "synthetic_example",
      "review_state": "synthetic_example",
      "guideline_version": "0.1.0",
      "annotated_at": "2026-08-14T00:00:00Z",
      "is_synthetic_example": true,
      "labels": {
        "adversariality": {
          "status": "scored",
          "score": 0,
          "confidence": "high",
          "rationale_codes": ["explicit_safe_purpose"],
          "note": "Örnek, savunma amaçlı teknik bir görevi açıkça belirtiyor."
        },
        "maliciousness": {
          "status": "scored",
          "score": 0,
          "confidence": "high",
          "rationale_codes": ["explicit_safe_purpose"]
        },
        "legitimate_plausibility": {
          "status": "scored",
          "score": 4,
          "confidence": "high",
          "rationale_codes": ["explicit_safe_purpose", "explicit_authorization"]
        },
        "context_dependence": {
          "status": "not_applicable",
          "confidence": "high",
          "rationale_codes": ["not_enough_evidence"]
        },
        "expected_risk": {
          "status": "scored",
          "score": 1,
          "confidence": "medium",
          "rationale_codes": ["harm_impact"]
        },
        "refusal_appropriateness": {
          "value": "allow_safe_completion",
          "confidence": "high",
          "rationale_codes": ["explicit_safe_purpose"]
        }
      },
      "confidence": {
        "level": "high",
        "rationale_codes": ["explicit_safe_purpose"]
      },
      "rationale_summary": "Bu yalnızca sentetik bir örnektir; gerçek pilot kaydına veya uzman kararına dayanmamaktadır."
    },
    {
      "annotation_id": "synthetic-annotation-002",
      "sample_id": "synthetic-adversarial-001",
      "record_type": "single_turn",
      "annotator_id": "synthetic-example-only",
      "annotator_role": "synthetic_example",
      "review_state": "synthetic_example",
      "guideline_version": "0.1.0",
      "annotated_at": "2026-08-14T00:00:00Z",
      "is_synthetic_example": true,
      "labels": {
        "adversariality": {
          "status": "scored",
          "score": 4,
          "confidence": "medium",
          "rationale_codes": ["policy_evasion_signal", "redacted_content"]
        },
        "maliciousness": {
          "status": "scored",
          "score": 2,
          "confidence": "low",
          "rationale_codes": ["ambiguous_intent", "redacted_content"],
          "note": "Operasyonel ayrıntıların redakte edilmesi niyet hakkında kesinlik bırakmıyor."
        },
        "legitimate_plausibility": {
          "status": "scored",
          "score": 1,
          "confidence": "medium",
          "rationale_codes": ["policy_evasion_signal", "redacted_content"]
        },
        "context_dependence": {
          "status": "not_applicable",
          "confidence": "high",
          "rationale_codes": ["not_enough_evidence"]
        },
        "expected_risk": {
          "status": "scored",
          "score": 3,
          "confidence": "medium",
          "rationale_codes": ["harm_capability", "harm_impact", "redacted_content"]
        },
        "refusal_appropriateness": {
          "value": "refusal_appropriate",
          "confidence": "medium",
          "rationale_codes": ["policy_evasion_signal", "harm_capability"]
        }
      },
      "confidence": {
        "level": "medium",
        "rationale_codes": ["redacted_content", "ambiguous_intent"]
      },
      "rationale_summary": "Bu yalnızca redakte edilmiş sentetik bir değerlendirme örneğidir; gerçek saldırı içeriği veya uzman kararı değildir."
    },
    {
      "annotation_id": "synthetic-annotation-003",
      "sample_id": "synthetic-multiturn-001",
      "record_type": "multi_turn",
      "annotator_id": "synthetic-example-only",
      "annotator_role": "synthetic_example",
      "review_state": "synthetic_example",
      "guideline_version": "0.1.0",
      "annotated_at": "2026-08-14T00:00:00Z",
      "is_synthetic_example": true,
      "labels": {
        "adversariality": {
          "status": "scored",
          "score": 0,
          "confidence": "high",
          "rationale_codes": ["explicit_safe_purpose"]
        },
        "maliciousness": {
          "status": "scored",
          "score": 0,
          "confidence": "high",
          "rationale_codes": ["explicit_authorization", "explicit_safe_purpose"]
        },
        "legitimate_plausibility": {
          "status": "scored",
          "score": 4,
          "confidence": "high",
          "rationale_codes": ["explicit_authorization", "context_changes_meaning"]
        },
        "context_dependence": {
          "status": "scored",
          "score": 4,
          "confidence": "high",
          "rationale_codes": ["context_is_essential", "context_changes_meaning"]
        },
        "expected_risk": {
          "status": "scored",
          "score": 1,
          "confidence": "medium",
          "rationale_codes": ["explicit_safe_purpose"]
        },
        "refusal_appropriateness": {
          "value": "allow_with_boundaries",
          "confidence": "high",
          "rationale_codes": ["explicit_authorization", "context_changes_meaning"]
        }
      },
      "confidence": {
        "level": "high",
        "rationale_codes": ["explicit_authorization", "context_is_essential"]
      },
      "rationale_summary": "Bağlam, isteğin yetkili ve savunma amaçlı olduğunu açıklıyor. Bu kayıt yalnızca sentetik eğitim örneğidir."
    }
  ]
}
